{
  "schema_version": "0.1.0",
  "id": "memory-coalesced-matrix-copy",
  "title": "Coalesced Row-Major Matrix Copy",
  "domain": "memory",
  "language": "hip-cpp",
  "tags": [
    "coalescing",
    "strided-access",
    "launch-config"
  ],
  "source_refs": [
    "amd-rocm-programming-guide",
    "amd-rocprofiler-docs"
  ],
  "problem": {
    "summary": "Copy a row-major matrix from input to output while preserving values. The baseline maps adjacent lanes across rows, causing strided row-major access. The optimized version maps adjacent lanes across columns.",
    "inputs": [
      "float* input",
      "float* output",
      "int rows",
      "int cols"
    ],
    "outputs": [
      "output contains input[row * cols + col] for every valid element"
    ],
    "constraints": [
      "rows and cols may not be multiples of the block dimensions",
      "input and output do not alias"
    ]
  },
  "artifacts": {
    "baseline": "source/baseline.hip",
    "optimized": "source/optimized.hip",
    "results": [
      "results/baseline-4096x4096-20260528T172448Z.json",
      "results/optimized-4096x4096-20260528T172521Z.json"
    ]
  },
  "verification": {
    "status": "passed-gfx1201-timing-only",
    "method": "Compare output against host or device reference copy for multiple matrix shapes. The 4096x4096 gfx1201 run passed with max_abs_error=0 and bad_count=0.",
    "tolerances": {}
  },
  "benchmarking": {
    "status": "timing-only-gfx1201",
    "operation": "copy",
    "required_metrics": [
      "median kernel duration",
      "global load sectors per request",
      "global store sectors per request",
      "effective memory bandwidth"
    ],
    "recommended_shapes": [
      "4096x4096",
      "8192x1024",
      "1024x8192",
      "1009x2039"
    ]
  },
  "license": "Project seed example",
  "curation": {
    "status": "timing-only",
    "notes": "Ported from the CUDA corpus on 2026-05-20. On 2026-05-28, AMD Radeon RX 9070 XT gfx1201 HIP-event timing measured 3.28205 ms baseline versus 0.23530 ms optimized for 4096x4096 fp32 copy, speedup 13.948364x. No rocprofiler/rocprof counters were collected."
  }
}
