{
  "schema_version": "0.1.0",
  "id": "block-topk-sampling",
  "title": "Block Top-K Temperature Sampling",
  "domain": "llm-inference",
  "language": "hip-cpp",
  "tags": [
    "selection",
    "top-k",
    "sampling",
    "logits",
    "block-reduction",
    "llm-decode"
  ],
  "source_refs": [
    "amd-rocm-programming-guide",
    "rocm-rocprim",
    "vllm",
    "flashinfer"
  ],
  "problem": {
    "summary": "Given row-major logits and one uniform random value per row, select the top-k logits, compute a temperature-scaled softmax over those candidates, and return one sampled token id. The baseline assigns one thread to each row. The optimized seed assigns one block to each row, builds per-thread candidate lists, and merges them with a shared-memory block reduction.",
    "inputs": [
      "float* logits shaped [rows, vocab_size]",
      "float* uniforms shaped [rows]",
      "int rows",
      "int vocab_size",
      "int k in [1, 8]",
      "float temperature > 0"
    ],
    "outputs": [
      "int* sampled_indices shaped [rows]",
      "int* topk_indices shaped [rows, k]",
      "float* topk_values shaped [rows, k]",
      "float* topk_probs shaped [rows, k]"
    ],
    "constraints": [
      "The seed kernels support float logits and k <= 8",
      "Top-k candidates are sorted by descending logit with lower token id winning ties",
      "The sampling distribution is softmax(top_k_logits / temperature)",
      "NaN handling is not part of this seed contract"
    ]
  },
  "artifacts": {
    "baseline": "source/baseline.hip",
    "optimized": "source/optimized.hip",
    "harness": "../../../harnesses/topk_sampling_benchmark.hip",
    "results": [
      "results/pytorch-eager-1024x32768-k4-t0.8-20260528T172210Z.json",
      "results/baseline-1024x32768-k4-t0.8-20260528T174012Z.json",
      "results/optimized-1024x32768-k4-t0.8-20260528T174031Z.json",
      "results/baseline-1024x1009-k4-t0.8-20260528T183400Z.json",
      "results/optimized-1024x1009-k4-t0.8-20260528T183420Z.json"
    ]
  },
  "verification": {
    "status": "passed-gfx1201-timing-only",
    "method": "HIP harness compares top-k indices, raw top-k values, top-k probabilities, and sampled ids against a CPU reference with deterministic tie handling. The 1024x32768 and 1024x1009 k=4 temperature=0.8 gfx1201 HIP runs passed with zero index, sample, top-k value, and probability mismatches.",
    "tolerances": {
      "topk_index_mismatch_count": 0,
      "sample_mismatch_count": 0,
      "max_topk_value_abs_error": 1e-06,
      "max_probability_abs_error": 0.0001
    }
  },
  "benchmarking": {
    "status": "timing-only-gfx1201",
    "operation": "top-k-temperature-sampling",
    "required_metrics": [
      "median kernel duration",
      "p10 and p90 kernel duration",
      "logical_gib_per_s",
      "topk_index_mismatch_count",
      "sample_mismatch_count",
      "max_probability_abs_error",
      "hardware and build metadata",
      "evidence label"
    ],
    "recommended_shapes": [
      "rows=1024 vocab_size=32768 k=4 temperature=0.8",
      "rows=256 vocab_size=128256 k=8 temperature=0.7",
      "rows=4096 vocab_size=32000 k=1 temperature=1.0",
      "rows=1024 vocab_size=1009 k=4 temperature=0.8"
    ]
  },
  "license": "Project seed example",
  "curation": {
    "status": "timing-only",
    "notes": "Ported from the CUDA corpus on 2026-05-20. On 2026-05-28, AMD Radeon RX 9070 XT gfx1201 HIP-event timing measured 8.29195 ms baseline versus 0.59020 ms optimized for 1024x32768 k=4 temperature=0.8 top-k sampling, speedup 14.049390x; and 0.41830 ms baseline versus 0.18190 ms optimized for 1024x1009 k=4 temperature=0.8 top-k sampling, speedup 2.299615x. A PyTorch eager ROCm timing-only baseline for the full-vocab shape is also attached. No rocprofiler/rocprof counters were collected."
  }
}
