{
  "schema_version": "0.1.0",
  "id": "block-reduction-sum",
  "title": "Block Reduction Sum",
  "domain": "reduction",
  "language": "hip-cpp",
  "tags": [
    "reduction",
    "atomic-contention",
    "shared-memory",
    "block-reduction"
  ],
  "source_refs": [
    "amd-rocm-programming-guide",
    "rocm-rocprim"
  ],
  "problem": {
    "summary": "Sum an array of floats into one scalar. The baseline atomically adds every element to one global output. The optimized version reduces within each block and performs one atomic add per block.",
    "inputs": [
      "float* input",
      "float* output",
      "int n"
    ],
    "outputs": [
      "output[0] contains the sum of input values"
    ],
    "constraints": [
      "floating-point addition order may differ",
      "input values in the seed harness are chosen for stable correctness checks"
    ]
  },
  "artifacts": {
    "baseline": "source/baseline.hip",
    "optimized": "source/optimized.hip",
    "results": [
      "results/baseline-16777216-20260528T173429Z.json",
      "results/optimized-16777216-20260528T173445Z.json",
      "results/baseline-1048579-20260528T183207Z.json",
      "results/optimized-1048579-20260528T183224Z.json"
    ]
  },
  "verification": {
    "status": "passed-gfx1201-timing-only",
    "method": "Compare against CPU reference with absolute tolerance appropriate for input range. The 16777216-element and 1048579-element gfx1201 HIP runs passed with max_abs_error=0.",
    "tolerances": {
      "max_abs_error": 0.5
    }
  },
  "benchmarking": {
    "status": "timing-only-gfx1201",
    "operation": "sum",
    "required_metrics": [
      "median kernel duration",
      "speedup over per-element atomic baseline",
      "absolute error"
    ],
    "recommended_shapes": [
      "16777216",
      "16777219",
      "1048576",
      "65539"
    ]
  },
  "license": "Project seed example",
  "curation": {
    "status": "timing-only",
    "notes": "Ported from the CUDA corpus on 2026-05-20. On 2026-05-28, AMD Radeon RX 9070 XT gfx1201 HIP-event timing measured 36.872601 ms baseline versus 2.19150 ms optimized for a 16777216-element fp32 sum, speedup 16.825280x; and 2.22090 ms baseline versus 0.14555 ms optimized for a 1048579-element fp32 sum, speedup 15.258674x. No rocprofiler/rocprof counters were collected."
  }
}
