{
  "schema_version": "0.1.0",
  "id": "rowwise-softmax",
  "title": "Row-Wise Softmax",
  "domain": "deep-learning",
  "language": "hip-cpp",
  "tags": [
    "softmax",
    "row-reduction",
    "numerical-stability",
    "shared-memory"
  ],
  "source_refs": [
    "amd-rocm-programming-guide",
    "kernelbench",
    "gpu-mode"
  ],
  "problem": {
    "summary": "Compute a numerically stable softmax for each row of a row-major matrix. The baseline assigns one thread to each row. The optimized version assigns one block to each row and uses shared-memory reductions for max and sum.",
    "inputs": [
      "float* input",
      "float* output",
      "int rows",
      "int cols"
    ],
    "outputs": [
      "Each output row is softmax(input row) and sums approximately to 1"
    ],
    "constraints": [
      "The optimized seed assumes moderate column counts that fit one block-per-row reduction",
      "floating-point differences are expected"
    ]
  },
  "artifacts": {
    "baseline": "source/baseline.hip",
    "optimized": "source/optimized.hip",
    "results": [
      "results/pytorch-eager-4096x1024-20260528T172208Z.json",
      "results/baseline-4096x1024-20260528T173352Z.json",
      "results/optimized-4096x1024-20260528T173410Z.json"
    ]
  },
  "verification": {
    "status": "passed-gfx1201-timing-only",
    "method": "Compare against CPU stable softmax and check row sums. The 4096x1024 gfx1201 HIP runs passed with max_abs_error=0 and max_row_sum_error<=1e-6.",
    "tolerances": {
      "max_abs_error": 1e-05,
      "max_row_sum_error": 0.0001
    }
  },
  "benchmarking": {
    "status": "timing-only-gfx1201",
    "operation": "rowwise-softmax",
    "required_metrics": [
      "median kernel duration",
      "max_abs_error",
      "max_row_sum_error"
    ],
    "recommended_shapes": [
      "4096x1024",
      "1024x2048",
      "4096x1000",
      "128x128"
    ]
  },
  "license": "Project seed example",
  "curation": {
    "status": "timing-only",
    "notes": "Ported from the CUDA corpus on 2026-05-20. On 2026-05-28, AMD Radeon RX 9070 XT gfx1201 HIP-event timing measured 0.57060 ms baseline versus 0.07170 ms optimized for 4096x1024 fp32 softmax, speedup 7.958159x. A PyTorch eager ROCm timing-only baseline is also attached. No rocprofiler/rocprof counters were collected."
  }
}
